{
 "categories": [],
 "classes": [
  {
   "class_methods": [],
   "info": 1,
   "instance_methods": [
    {
     "selector": "completeInitializationOfObject:",
     "types": "v8@4:8@12"
    },
    {
     "selector": "faultWillFire:",
     "types": "v8@4:8@12"
    },
    {
     "selector": "shouldPerformInvocation:",
     "types": "c8@4:8@12"
    },
    {
     "selector": "methodSignatureForSelector:forFault:",
     "types": "@12@4:8:12@16"
    },
    {
     "selector": "respondsToSelector:forFault:",
     "types": "c12@4:8:12@16"
    },
    {
     "selector": "conformsToProtocol:forFault:",
     "types": "c12@4:8@12@16"
    },
    {
     "selector": "isMemberOfClass:forFault:",
     "types": "c12@4:8#12@16"
    },
    {
     "selector": "isKindOfClass:forFault:",
     "types": "c12@4:8#12@16"
    },
    {
     "selector": "classForFault:",
     "types": "#8@4:8@12"
    },
    {
     "selector": "descriptionForObject:",
     "types": "@8@4:8@12"
    },
    {
     "selector": "extraRefCount",
     "types": "I4@4:8"
    },
    {
     "selector": "decrementExtraRefCountWasZero",
     "types": "c4@4:8"
    },
    {
     "selector": "incrementExtraRefCount",
     "types": "v4@4:8"
    },
    {
     "selector": "extraData",
     "types": "^v4@4:8"
    },
    {
     "selector": "targetClass",
     "types": "#4@4:8"
    },
    {
     "selector": "setTargetClass:extraData:",
     "types": "v12@4:8#12^v16"
    }
   ],
   "instance_size": 16,
   "ivars": [
    {
     "name": "_targetClass",
     "offset": 4,
     "type": "#"
    },
    {
     "name": "_extraData",
     "offset": 8,
     "type": "^v"
    },
    {
     "name": "_extraRefCount",
     "offset": 12,
     "type": "I"
    }
   ],
   "name": "NSFaultHandler",
   "superclass": "NSObject"
  },
  {
   "class_methods": [
    {
     "selector": "clearFault:",
     "types": "v8@4:8@12"
    },
    {
     "selector": "makeObjectIntoFault:withHandler:",
     "types": "v12@4:8@12@16"
    },
    {
     "selector": "targetClassForFault:",
     "types": "#8@4:8@12"
    },
    {
     "selector": "handlerForFault:",
     "types": "@8@4:8@12"
    },
    {
     "selector": "isFault:",
     "types": "c8@4:8@12"
    },
    {
     "selector": "zone",
     "types": "^{?=}4@4:8"
    },
    {
     "selector": "superclass",
     "types": "#4@4:8"
    },
    {
     "selector": "self",
     "types": "@4@4:8"
    },
    {
     "selector": "retainCount",
     "types": "I4@4:8"
    },
    {
     "selector": "retain",
     "types": "@4@4:8"
    },
    {
     "selector": "release",
     "types": "v4@4:8"
    },
    {
     "selector": "respondsToSelector:",
     "types": "c8@4:8:12"
    },
    {
     "selector": "performSelector:withObject:withObject:",
     "types": "@16@4:8:12@16@20"
    },
    {
     "selector": "performSelector:withObject:",
     "types": "@12@4:8:12@16"
    },
    {
     "selector": "performSelector:",
     "types": "@8@4:8:12"
    },
    {
     "selector": "isProxy",
     "types": "c4@4:8"
    },
    {
     "selector": "isFault",
     "types": "c4@4:8"
    },
    {
     "selector": "isMemberOfClass:",
     "types": "c8@4:8#12"
    },
    {
     "selector": "isKindOfClass:",
     "types": "c8@4:8#12"
    },
    {
     "selector": "isEqual:",
     "types": "c8@4:8@12"
    },
    {
     "selector": "hash",
     "types": "I4@4:8"
    },
    {
     "selector": "doesNotRecognizeSelector:",
     "types": "v8@4:8:12"
    },
    {
     "selector": "debugDescription",
     "types": "@4@4:8"
    },
    {
     "selector": "description",
     "types": "@4@4:8"
    },
    {
     "selector": "conformsToProtocol:",
     "types": "c8@4:8@12"
    },
    {
     "selector": "class",
     "types": "#4@4:8"
    },
    {
     "selector": "autorelease",
     "types": "@4@4:8"
    },
    {
     "selector": "initialize",
     "types": "v4@4:8"
    },
    {
     "selector": "load",
     "types": "v4@4:8"
    }
   ],
   "info": 1,
   "instance_methods": [
    {
     "selector": "forwardInvocation:",
     "types": "v8@4:8@12"
    },
    {
     "selector": "dealloc",
     "types": "v4@4:8"
    },
    {
     "selector": "zone",
     "types": "^{?=}4@4:8"
    },
    {
     "selector": "superclass",
     "types": "#4@4:8"
    },
    {
     "selector": "self",
     "types": "@4@4:8"
    },
    {
     "selector": "retainCount",
     "types": "I4@4:8"
    },
    {
     "selector": "retain",
     "types": "@4@4:8"
    },
    {
     "selector": "release",
     "types": "v4@4:8"
    },
    {
     "selector": "respondsToSelector:",
     "types": "c8@4:8:12"
    },
    {
     "selector": "methodSignatureForSelector:",
     "types": "@8@4:8:12"
    },
    {
     "selector": "isProxy",
     "types": "c4@4:8"
    },
    {
     "selector": "isFault",
     "types": "c4@4:8"
    },
    {
     "selector": "isMemberOfClass:",
     "types": "c8@4:8#12"
    },
    {
     "selector": "isKindOfClass:",
     "types": "c8@4:8#12"
    },
    {
     "selector": "forward::",
     "types": "@12@4:8:12^v16"
    },
    {
     "selector": "doesNotRecognizeSelector:",
     "types": "v8@4:8:12"
    },
    {
     "selector": "debugDescription",
     "types": "@4@4:8"
    },
    {
     "selector": "description",
     "types": "@4@4:8"
    },
    {
     "selector": "conformsToProtocol:",
     "types": "c8@4:8@12"
    },
    {
     "selector": "class",
     "types": "#4@4:8"
    },
    {
     "selector": "autorelease",
     "types": "@4@4:8"
    }
   ],
   "instance_size": 8,
   "ivars": [
    {
     "name": "isa",
     "offset": 0,
     "type": "#"
    },
    {
     "name": "_handler",
     "offset": 4,
     "type": "@\"NSFaultHandler\""
    }
   ],
   "name": "NSFault",
   "superclass": null
  }
 ],
 "data_symbols": [],
 "module": "NSFault.m",
 "schema_version": "abi-v1",
 "text_symbols": []
}
