{
 "categories": [],
 "classes": [
  {
   "class_methods": [],
   "info": 1,
   "instance_methods": [
    {
     "selector": "dealloc",
     "types": "v4@4:8"
    },
    {
     "selector": "allObjects",
     "types": "@4@4:8"
    },
    {
     "selector": "nextObject",
     "types": "@4@4:8"
    },
    {
     "selector": "invalidate",
     "types": "v4@4:8"
    },
    {
     "selector": "initWithObjects:count:target:reverse:freeWhenDone:",
     "types": "@21@4:8^@12I16@20c24c28"
    }
   ],
   "instance_size": 24,
   "ivars": [
    {
     "name": "_slot",
     "offset": 4,
     "type": "I"
    },
    {
     "name": "_limit",
     "offset": 8,
     "type": "I"
    },
    {
     "name": "_target",
     "offset": 12,
     "type": "@"
    },
    {
     "name": "_list",
     "offset": 16,
     "type": "^@"
    },
    {
     "name": "_free",
     "offset": 20,
     "type": "c"
    }
   ],
   "name": "NSIdEnumerator",
   "superclass": "NSEnumerator"
  },
  {
   "class_methods": [],
   "info": 1,
   "instance_methods": [
    {
     "selector": "allObjects",
     "types": "@4@4:8"
    },
    {
     "selector": "nextObject",
     "types": "@4@4:8"
    }
   ],
   "instance_size": 4,
   "ivars": [],
   "name": "NSEnumerator",
   "superclass": "NSObject"
  }
 ],
 "data_symbols": [],
 "module": "NSEnumerator.m",
 "schema_version": "abi-v1",
 "text_symbols": []
}
